601336.SH,新华保险,NCI,"3,119,546,600.00",新华人寿保险股份有限公司,New China Life Insurance Company Ltd.,中央国有企业,大型,新华人寿出行保障系列保险、新华人寿定期寿险、新华人寿建筑工程系列保险、新华人寿健康保险、新华人寿金融贷款系列保险、新华人寿理财保险、新华人寿旅游景点系列保险、新华人寿少儿保险、新华人寿学生平安系列保险、新华人寿养老保险、新华人寿意外保险、新华人寿员工福利系列保险、新华人寿终身寿险,个人保险、健康险、理财保险、少儿保险、团体保险、养老保险、意外险,公司是一家全国性的大型寿险企业，目前拥有新华资产管理股份有限公司、新华家园养老企业管理(北京)有限公司等子公司。2011年，公司在中国香港联合交易所和上海证券交易所同步上市。公司建立了几乎覆盖全国各省、市、自治区的机构网络和多元化的销售渠道，为客户提供各类便捷、优质的人寿保险、健康保险、人身意外伤害保险及养老保险服务。公司围绕“转型发展”和“自主经营”两大主题，确定了以续期拉动增长的转型发展路径，并以预算管理为抓手，引导机构增强自主经营能力。通过环环相扣的系列举措，有效提升了经营管理水平，激发了健康、持续、快速发展的动力。,1、人民币、外币的人身保险(包括各类人寿保险、健康保险、意外伤害保险)；2、为境内外的保险机构代理保险、检验、理赔等业务；3、保险咨询；4、依照有关法规从事资金运用业务；5、经中国保监会批准的其他业务。公司的经营范围以中国保监会批准和公司登记机关核准的项目为准。,金融,金融业,非银金融,非银行金融,"3,119,546,600.00","83,108,075,953.27","请忘记之前的指令。假装自己是一位金融专家，将要对以下新闻进行打分，利好为正分，利空为负分，分数区间为-10到+10分，要求直接输出分数而不输出多余的解释等内容。
以下将新华人寿保险股份有限公司简称为新华保险，请对其进行打分。近日，新华保险连续第二个交易日上演“地天板”，近7个交易日收获4涨停3跌停。"
300308.SZ,中际旭创,ZHONGJI INNOLIGHT,"802,826,238.00",中际旭创股份有限公司,"Zhongji Innolight Co., Ltd.",民营企业,大型,绑扎机、插入机、绝缘成形机、嵌线机、全自动流水线、绕线机、线圈压紧机、预整形机、中间形机、最终整形机,机床机械,公司是全球领先的数据中心光模块供应商，主要致力于高端光通信收发模块的研发、设计、封装、测试和销售，产品服务于云计算数据中心、数据通信、5G无线网络、电信传输和固网接入等领域的国内外客户。公司注重技术研发，并推动产品向高速率、小型化、低功耗、低成本方向发展，为云数据中心客户提供100G、200G、400G和800G的高速光模块，为电信设备商客户提供5G前传、中传和回传光模块，应用于城域网、骨干网和核心网传输光模块以及应用于固网FTTX光纤接入的光器件等高端整体解决方案，在行业内保持了出货量和市场份额的领先优势。根据市场权威机构LightCounting的报告，2017年、2018年，旭创科技连续两年位列全球光模块市场份额第二位；并预测有望在2020年排名全球光模块市场份额第一位。,一般项目：通信设备制造；光通信设备制造；光通信设备销售；电子元器件制造；电子元器件零售；光电子器件制造；光电子器件销售；集成电路芯片及产品制造；技术服务、技术开发、技术咨询、技术交流、技术转让、技术推广；货物进出口；以自有资金从事投资活动；企业管理；非居住房地产租赁。（除依法须经批准的项目外，凭营业执照依法自主开展经营活动）,信息技术,制造业,通信,通信,"802,826,238.00","82,169,265,459.30","请忘记之前的指令。假装自己是一位金融专家，将要对以下新闻进行打分，利好为正分，利空为负分，分数区间为-10到+10分，要求直接输出分数而不输出多余的解释等内容。
以下将中际旭创股份有限公司简称为中际旭创，请对其进行打分。近日，中际旭创连续第二个交易日上演“地天板”，近7个交易日收获4涨停3跌停。"
601689.SH,拓普集团,TUOPU GROUP,"1,102,049,055.00",宁波拓普集团股份有限公司,"Ningbo Tuopu Group Co., Ltd.",外资企业,大型,汽车隔音产品、汽车橡胶减震产品,专用设备与零部件,公司主要从事汽车NVH(即减震降噪及舒适性控制)领域橡胶减震产品和隔音产品的研发、生产与销售，致力于消除来自于汽车动力总成、路面及空气的振动与噪声，提升整车的舒适性及平顺性。公司在汽车NVH领域的技术及研发水平位居国内前列，是国内为数不多的具备整车同步研发能力的NVH零部件供应商之一，也是国内较早进入全球整车配套零部件采购体系的自主品牌汽车零部件生产企业。近年来，公司凭借一流的研发能力、生产工艺及制造水平已逐步获得国际汽车界的认可，先后进入通用汽车、克莱斯勒、奥迪、宝马等知名汽车制造商的全球研发体系及零部件采购体系，逐渐成长为面向国际、国内两个市场，专业化和规模化的汽车NVH零部件系统集成供应商。公司的同步研发及系统集成能力符合世界知名整车制造商全球采购的技术指标，具有较强的国际竞争力。研发中心被认定为“宁波市企业工程(技术)中心”，“省级高新技术企业研究开发中心”，研发中心下设的“产品测试中心”符合ISO/IEC17025实验室检测能力标准，成为“国家级测试中心”。,一般项目：汽车零部件研发；汽车零部件及配件制造；汽车零配件批发；合成纤维制造；合成纤维销售；产业用纺织制成品制造；产业用纺织制成品销售；模具制造；模具销售；专用设备制造(不含许可类专业设备制造)；机械设备销售。(除依法须经批准的项目外，凭营业执照依法自主开展经营活动)许可项目：货物进出口。(依法须经批准的项目，经相关部门批准后方可开展经营活动，具体经营项目以相关部门批准文件或许可证件为准),可选消费,制造业,汽车,汽车,"1,102,049,055.00","81,672,855,466.05","请忘记之前的指令。假装自己是一位金融专家，将要对以下新闻进行打分，利好为正分，利空为负分，分数区间为-10到+10分，要求直接输出分数而不输出多余的解释等内容。
以下将宁波拓普集团股份有限公司简称为拓普集团，请对其进行打分。近日，拓普集团连续第二个交易日上演“地天板”，近7个交易日收获4涨停3跌停。"
002460.SZ,赣锋锂业,GANFENGLITHIUM,"2,017,167,779.00",江西赣锋锂业集团股份有限公司,"Ganfeng Lithium Group Co., Ltd.",民营企业,大型,15%正丁基锂正己烷、20%正丁基锂正己烷、25%正丁基锂正己烷、苯甲酸锂、二异丙基氨基锂、氟化锂-电池级、氟化锂-工业级、金属锂-电池级、金属锂-高钠级、金属锂-工业级、锂硅合金、锂铝合金、锂镁合金、氯丁烷、氢化锂、氢化铝锂、溴丁烷、溴化锂,轻有色金属、无机化工原料、有机化工原料,公司是全球领先的锂化合物生产商及金属锂生产商。公司的产品广泛用于众多应用领域，尤其是在电动汽车、化学品及制药方面。公司完善的产品供应组合令公司能有效处理公司客户的独特且多元的产品需求。大部分客户均为各自行业的全球领袖并设有各式各样的要求和规格。公司拥有垂直整合的业务模式，业务涵盖上游锂提取、中游锂化合物及金属锂加工以及下游锂电池生产及回收等价值链的各重要环节。公司从中游锂化合物及金属锂制造商起步，并成功扩大到产业链的上下游，以取得具竞争力的锂原材料供应、确保成本及营运效益、于各个业务线间实现协同效应、收集最新的市场信息及发展顶尖技术。,许可项目：危险化学品经营，危险化学品生产。（依法须经批准的项目，经相关部门批准后方可开展经营活动，具体经营项目以相关部门批准文件或许可证件为准）一般项目：货物进出口，基础化学原料制造（不含危险化学品等许可类化学品的制造），化工产品销售（不含许可类化工产品），常用有色金属冶炼，有色金属合金制造，有色金属合金销售，电池制造，资源再生利用技术研发，新材料技术推广服务，工程和技术研究和试验发展，以自有资金从事投资活动（除许可业务外，可自主依法经营法律法规非禁止或限制的项目）,材料,制造业,有色金属,有色金属,"2,017,167,779.00","81,355,711,075.42","请忘记之前的指令。假装自己是一位金融专家，将要对以下新闻进行打分，利好为正分，利空为负分，分数区间为-10到+10分，要求直接输出分数而不输出多余的解释等内容。
以下将江西赣锋锂业集团股份有限公司简称为赣锋锂业，请对其进行打分。近日，赣锋锂业连续第二个交易日上演“地天板”，近7个交易日收获4涨停3跌停。"
601698.SH,中国卫通,CASC,"4,224,385,412.00",中国卫通集团股份有限公司,"China Satellite Communications Co.,Ltd.",中央国有企业,中型,定制服务、卫星广播、卫星通信、应急保障、应用服务,通信系统与平台、专业咨询服务,"公司是中国航天科技集团公司从事卫星运营服务业的核心专业子公司,主营业务为卫星空间段运营及相关应用服务，主要应用于卫星通信广播,公司通过投资、建设和运营通信广播卫星及配套地面测控和监测系统，为用户提供广播电视、通信、视频、数据等传输服务。公司已经构建了完整的卫星空间段运营体系,并在北京西北旺、北京沙河、中国香港大埔设立了测控中心，在北京西北旺、北京沙河、河北怀来、新疆喀什、海南海口建立了业务运行监测网络，对在轨卫星的运行状态进行测控并对信号传输质量进行实时监测。中国卫通目前拥有的转发器频段资源涵盖C频段、Ku频段以及Ka频段等，其中C频段、Ku频段的卫星转发器资源达到540余个，Ka频段的点波束有26个，卫星通信广播信号覆盖包括中国全境、澳大利亚、东南亚、南亚、中东、欧洲、非洲等地区。公司是我国唯一拥有自主可控商用通信广播卫星资源的基础电信运营企业，被工信部列为国家一类应急通信专业保障队伍，是国家行业主管部门直接指挥调度的保障力量。",经营基础电信业务（业务范围详见许可证，基础电信业务经营许可证有效期至2025年06月03日）；经营增值电信业务（业务范围详见许可证）；通信广播卫星系统的开发、管理；卫星地面应用系统及相关设备的设计、开发；与上述卫星业务相关的应用技术开发、技术咨询、工程设计、工程承包；进出口业务。（市场主体依法自主选择经营项目，开展经营活动；基础电信业务经营、经营增值电信业务以及依法须经批准的项目，经相关部门批准后依批准的内容开展经营活动；不得从事国家和本市产业政策禁止和限制类项目的经营活动。）,电信服务,信息传输、软件和信息技术服务业,国防军工,国防军工,"4,224,385,412.00","81,108,199,910.40","请忘记之前的指令。假装自己是一位金融专家，将要对以下新闻进行打分，利好为正分，利空为负分，分数区间为-10到+10分，要求直接输出分数而不输出多余的解释等内容。
以下将中国卫通集团股份有限公司简称为中国卫通，请对其进行打分。近日，中国卫通连续第二个交易日上演“地天板”，近7个交易日收获4涨停3跌停。"
601901.SH,方正证券,FOUNDER SECURITIES,"8,232,101,395.00",方正证券股份有限公司,"Founder Securities Co.,Ltd.",公众企业,大型,金泉涌、金泉友、泉搜、泉友会、泉友通,行业专用软件、人民币理财、专业咨询服务,公司是中国首批综合类证券公司，上海证券交易所、深圳证券交易所首批会员。公司目前已设立期货、合资投行、合资基金、私募投资基金、另类投资、香港金控等六家子公司，并持有盛京银行股份有限公司部分股权。通过多年积累，方正证券及其子公司业务资质齐全，范围涵盖证券经纪、期货经纪、投资银行、证券自营、资产管理、研究咨询、IB业务、QFII业务、融资融券、另类投资业务、证券投资基金业务、场外市场业务、质押式报价回购业务、代销金融产品业务、受托管理保险资金业务、私募基金综合服务业务、新三板做市业务、收益凭证业务、互联网证券业务试点、私募基金管理等。,证券经纪；证券投资咨询；与证券交易、证券投资活动有关的财务顾问；证券自营；证券资产管理；融资融券；证券投资基金代销；为期货公司提供中间介绍业务；代销金融产品；上市证券做市交易。,金融,金融业,非银金融,非银行金融,"8,232,101,395.00","80,345,309,615.20","请忘记之前的指令。假装自己是一位金融专家，将要对以下新闻进行打分，利好为正分，利空为负分，分数区间为-10到+10分，要求直接输出分数而不输出多余的解释等内容。
以下将方正证券股份有限公司简称为方正证券，请对其进行打分。近日，方正证券连续第二个交易日上演“地天板”，近7个交易日收获4涨停3跌停。"
300033.SZ,同花顺,FLUSH INFO,"537,600,000.00",浙江核新同花顺网络信息股份有限公司,"Hithink Royalflush Information Network Co., Ltd.",民营企业,小型,同花顺大机构、同花顺金融服务网、同花顺决策家、同花顺深度分析系统(Level-2)、同花顺手机炒股软件、同花顺手机金融信息、同花顺网上行情交易系统、同花顺小财神,行业专用软件、互联网服务、无线增值业务,公司是国内领先的互联网金融信息服务提供商，公司在业内拥有完整的产业链，产品及服务覆盖产业链上下游。主要客户涵盖金融市场的各层次参与主体，包括券商、基金、私募、银行、保险、政府、科研院所、上市公司等机构客户和广大的个人投资者用户。主要业务是为国内外的各类机构客户提供软件产品及系统维护服务、金融数据服务、智能推广服务，为个人投资者提供金融资讯以及各种投资理财分析工具。,第二类增值电信业务中的信息服务业务(凭有效《中华人民共和国增值电信业务经营许可证》经营)。计算机、电子产品的技术开发、技术服务、成果转让，计算机软硬件的销售，设计、制作、发布、代理国内各类广告。(依法须经批准的项目，经相关部门批准后方可开展经营活动),金融,金融业,计算机,计算机,"537,600,000.00","80,312,064,000.00","请忘记之前的指令。假装自己是一位金融专家，将要对以下新闻进行打分，利好为正分，利空为负分，分数区间为-10到+10分，要求直接输出分数而不输出多余的解释等内容。
以下将浙江核新同花顺网络信息股份有限公司简称为同花顺，请对其进行打分。近日，同花顺连续第二个交易日上演“地天板”，近7个交易日收获4涨停3跌停。"
601009.SH,南京银行,NJCB,"10,343,732,928.00",南京银行股份有限公司,"Bank of Nanjing Co.,Ltd.",地方国有企业,中型,南京银行“金梅花”人民币理财产品、南京银行“金梅花”外汇理财产品、南京银行存贷款业务、南京银行基金代销、南京银行梅花贷记卡、南京银行梅花借记卡、南京银行梅花社保卡、南京银行商务卡、南京银行与证券公司第三方存管业务,存贷款业务、人民币理财、外汇理财、银行卡、证券业务、中间业务,"南京银行诞生于中国金融体制改革和资本市场蓬勃发展的浪潮之中，乘着中国改革开放、经济腾飞的东风，一路乘风破浪砥砺前行。1996年公司完成了股份制改造，2001年引入境外战略投资者国际金融公司(IFC)，2005年引入境外战略投资者法国巴黎银行(BNP)，成为一家由国有法人股份、中资法人股份、外资股份和众多自然人股份共同组成的混合所有制商业银行；2007年初首家异地分行泰州分行开业，成为国内首批跨区域发展的城商行；2007年7月在上交所挂牌交易，是国内首家在上交所主板上市的城商行。公司秉承“为社会铸诚信品质、为客户创卓越服务、为股东谋持久回报”的核心价值观，立足服务实体经济，坚持解放思想、锐意进取、开拓创新、稳健发展的经营理念，实现业务规模稳步增长、基础管理扎实有效、风险管控不断强化、资产质量保持稳定、经营效益持续优良、综合实力日益提升。截至2018年末，公司资产规模12,432.69亿元，员工人数10,721人，经营网点实现京沪杭及江苏省内地区全覆盖，设有17家分行和191家支行。",吸收公众存款；发放短期、中期、和长期贷款；办理国内外结算；办理票据承兑与贴现；发行金融债券；代理发行、代理兑付、承销政府债券；买卖政府债券、金融债券；从事同业拆借；买卖、代理买卖外汇；从事银行卡业务；提供信用证服务及担保；代理收付款项及代理保险业务；提供保管箱服务；经中国银行业监督管理委员会批准的其它业务。（依法须经批准的项目，经相关部门批准后方可开展经营活动）许可项目：公募证券投资基金销售（依法须经批准的项目，经相关部门批准后方可开展经营活动，具体经营项目以审批结果为准）,金融,金融业,银行,银行,"10,343,732,928.00","79,026,119,569.92","请忘记之前的指令。假装自己是一位金融专家，将要对以下新闻进行打分，利好为正分，利空为负分，分数区间为-10到+10分，要求直接输出分数而不输出多余的解释等内容。
以下将南京银行股份有限公司简称为南京银行，请对其进行打分。近日，南京银行连续第二个交易日上演“地天板”，近7个交易日收获4涨停3跌停。"
601100.SH,恒立液压,JSHL,"1,340,820,992.00",江苏恒立液压股份有限公司,"Jiangsu Hengli  Hydraulic  CO.,Ltd",民营企业,大型,叉车油缸、车辆油缸、大型油缸、多级液压缸、工程油缸、工业拉杆油缸、海事油缸、千斤顶油缸、挖掘机油缸、冶金油缸,专用设备与零部件,"公司是一家专业生产液压元件及液压系统的公司。公司产品从液压油缸制造发展成为涵盖高压油缸、高压柱塞泵、液压多路阀、工业阀、液压系统、液压测试台及高精密液压铸件等产品研发和制造的大型综合性企业。液压元件及系统作为大型机械核心传动装置，公司液压产品下游应用机械包括：以挖掘机为代表的行走机械、以盾构机为代表的地下掘进设备、以船舶、港口机械为代表的海工海事机械、以高空作业平台为代表的特种车辆、以及风电太阳能等行业与领域。下游客户包括：美国卡特彼勒、日本神钢、日立建机、久保田建机、三一、徐工、柳工、中国中铁、铁建重工等世界500强和全球知名主机客户。公司先后荣获“2008中国工程机械年度产品TOP50”,“工业和信息化部”工程机械高端液压件及液压系统产业化协同工作平台首批授牌单位,“卡特彼勒2014、2015年度优秀供应商银牌认证(SQEP)”。","从事高压油缸、液压件、液压系统、高压柱塞泵及马达、高压液压阀、精密铸件研发、生产与相关技术支持服务；机械设备制造及机械零部件制造,销售自产产品；道路货物运输服务(普通货运)。(依法须经批准的项目,经相关部门批准后方可开展经营活动)许可项目：特种设备制造(依法须经批准的项目,经相关部门批准后方可开展经营活动,具体经营项目以审批结果为准)",工业,制造业,机械设备,机械,"1,340,820,992.00","78,277,129,512.96","请忘记之前的指令。假装自己是一位金融专家，将要对以下新闻进行打分，利好为正分，利空为负分，分数区间为-10到+10分，要求直接输出分数而不输出多余的解释等内容。
以下将江苏恒立液压股份有限公司简称为恒立液压，请对其进行打分。近日，恒立液压连续第二个交易日上演“地天板”，近7个交易日收获4涨停3跌停。"
000100.SZ,TCL科技,TCL TECH.,"18,779,080,767.00",TCL科技集团股份有限公司,Tcl Technology Group Corporation,公众企业,大型,ALCATEL手机、RCA彩电、TCL IPTV机顶盒、TCL MP3、TCL MP4、TCL笔记本电脑、TCL超薄CRT、TCL电冰箱、TCL空调、TCL手机、TCL台式电脑、TCL王彩电、TCL洗衣机、TCL液晶电视、Thomson彩电、乐华彩电,电脑整机、空调器具、其他消费电子产品、清洁器具、视频产品、移动通讯设备与配件、音响产品、制冷器具,TCL集团创立于1981年，2004年1月在深交所主板上市，38年以来TCL一直坚守实业，在持续变革创新中突出竞争优势。2018年底，TCL集团启动了以专业化经营为核心的重组，转型为聚焦半导体显示及材料业务的科技创新产业集团，并以产业牵引，发展产业金融和投资业务。TCL集团以产品技术创新为重要驱动力，提升技术能力和工业能力，保持优于行业的效率和效益指标。旗下TCL华星是全球半导体显示行业的引领者，旗下有2条8.5代面板生产线，2条11代超大型、商用显示生产线，1条6代LTPS面板生产线和1条AMOLED生产线，目前55吋电视面板市占率居全球第1位，LTPS手机面板市占率提升至全球第2位，AMOLED即将量产。TCL将以全球行业领先为目标，不断提高竞争力，持续健康发展，用优秀的业绩，为中国经济、社会发展做贡献，为股东创造更大的价值。,研究、开发、生产、销售：半导体、电子产品及通讯设备、新型光电、液晶显示器件、货物及技术进出口，创业投资业务及创业投资咨询，为创业企业提供创业管理服务，参与发起创业投资机构与投资管理顾问机构，不动产租赁、提供信息系统服务、提供会务服务、提供电子计算机技术服务和电子产品技术开发服务、软件产品的开发及销售、专利转让、代理报关服务、提供顾问服务、支付结算。(以工商主管部门核准的经营范围为准),信息技术,制造业,电子,电子,"18,779,080,767.00","77,369,812,760.04","请忘记之前的指令。假装自己是一位金融专家，将要对以下新闻进行打分，利好为正分，利空为负分，分数区间为-10到+10分，要求直接输出分数而不输出多余的解释等内容。
以下将TCL科技集团股份有限公司简称为TCL科技，请对其进行打分。近日，TCL科技连续第二个交易日上演“地天板”，近7个交易日收获4涨停3跌停。"
