834014.BJ,特瑞斯,TRS,"125,705,240.00",特瑞斯能源装备股份有限公司,"Terrence Energy Co., Ltd.",民营企业,中型,特瑞斯标准天然气调压集成设备、特瑞斯非标撬装天然气集成系统、特瑞斯天然气调压核心部件及配套产品,专用设备与零部件,公司自1997年成立以来，一如既往专注于研发、生产、销售各类天然气输配专用调压、计量集成设备以及LNG应用的配套装备，经过多年的发展积累，已经形成天然气输配系统集成、核心零部件、LNG成套设备三大类，百余个品种的产品，涉及天然气的采集、输配、应用全过程；产品广泛使用于国内外各类天然气，发电、市政建设、清洁车辆等行业和领域，凭借过硬的质量保障体系和良好的客户口碑，占据了非常重要的市场份额，是同行业的领军企业。科技与创新是公司的立业之本，高素质人才是实现公司使命的唯一关键因素，具备特瑞斯特色的人才培养和选拔机制为公司的长久发展奠定了可靠的基础，自2002年始被持续认定为高新技术企业后，公司收获了一个又一个自有品牌和知识产权的成熟产品，实现了良性的可持续发展态势；依靠自身积累，建成了常州、北京两个现代化的专业工厂，1个省级工程技术中心，1个公司研发中心，与上海交大、中国石油大学、河海大学等知名高校建立了长期的产学研合作关系，保障公司始终处于领先技术的前沿，为公司再次腾飞插上了坚实的翅膀。,压力管道的设计、安装，压力管道元件、压力容器的设计、制造、安装，安全附件的制造(涉及特种设备许可范围的按特种设备设计、制造、安装许可核定范围)；石油、燃气设备及配件、自动化工程及信息系统集成、计算机软硬件、电子设备、机电产品的设计、开发、制造、销售、技术服务；自营和代理各类商品及技术的进出口业务(国家限定公司经营或禁止进出口的商品及技术除外)。(依法须经批准的项目，经相关部门批准后方可开展经营活动)许可项目：特种设备设计；特种设备制造；特种设备安装改造修理；电气安装服务(依法须经批准的项目，经相关部门批准后方可开展经营活动，具体经营项目以审批结果为准)一般项目：特种设备销售；通用设备制造(不含特种设备制造)；通用设备修理；专用设备制造(不含许可类专业设备制造)；专用设备修理；机械设备研发；机械设备销售；工业自动控制系统装置制造；工业自动控制系统装置销售；液压动力机械及元件制造；液压动力机械及元件销售；气压动力机械及元件制造；气压动力机械及元件销售；阀门和旋塞研发；普通阀门和旋塞制造(不含特种设备制造)；阀门和旋塞销售；智能仪器仪表制造；智能仪器仪表销售；供应用仪器仪表制造；供应用仪器仪表销售；普通机械设备安装服务；电子、机械设备维护(不含特种设备)；工业设计服务；工程和技术研究和试验发展；信息系统集成服务；智能控制系统集成；工业互联网数据服务；信息技术咨询服务；软件开发；技术服务、技术开发、技术咨询、技术交流、技术转让、技术推广(除依法须经批准的项目外，凭营业执照依法自主开展经营活动),能源,制造业,公用事业,机械,"125,705,240.00","1,057,181,068.40","请忘记之前的指令。假装自己是一位金融专家，将要对以下新闻进行打分，利好为正分，利空为负分，分数区间为-10到+10分，要求直接输出分数而不输出多余的解释等内容。
以下将特瑞斯能源装备股份有限公司简称为特瑞斯，请对其进行打分。近日，特瑞斯连续第二个交易日上演“地天板”，近7个交易日收获4涨停3跌停。"
836720.BJ,吉冈精密,YOSHIOKA,"190,231,400.00",无锡吉冈精密科技股份有限公司,"Wuxi Yoshioka Precision Technology Corp.,Ltd",民营企业,中型,吉冈精密安全带转轴、吉冈精密纯喷漆产品、吉冈精密灯具灯饰、吉冈精密电动工具配件、吉冈精密纺织机械配件、吉冈精密复印机零部件、吉冈精密行李架、吉冈精密航空件、吉冈精密户外路灯压铸件、吉冈精密模具、吉冈精密农用机械配件、吉冈精密散热器、吉冈精密医疗器械配件、吉冈精密蒸汽加热器,航空零部件、汽车及零配件经销、专用设备与零部件,公司是精密金属制品行业领先企业，专注于铝合金、锌合金精密零部件的研发、生产和销售，产品涵盖电子电器零部件、汽车零部件及其他零部件，主要应用于清洁电器、电动工具、通讯设备、车身主体结构、车载主机系统、动力系统及制动系统等。公司秉承“专业的技术、优异的品质、低廉的成本、严期的交付”的经营理念，凭借高标准、高质量、高性价比的产品进入多家海内外知名品牌制造商的供应链体系。,机械零部件、家用清洁卫生电器具、家用电力器具、汽车摩托车零部件、一类医疗器械、照明灯具、模具的研发、生产、销售；有色金属铸造及压延；自营和代理各类商品及技术的进出口业务(国家限定企业经营或禁止进出口的商品和技术除外)；发电业务、输电业务、供(配)电业务；合同能源管理；自有房屋租赁。(依法须经批准的项目，经相关部门批准后方可开展经营活动),工业,制造业,机械设备,机械,"190,231,400.00","1,051,979,642.00","请忘记之前的指令。假装自己是一位金融专家，将要对以下新闻进行打分，利好为正分，利空为负分，分数区间为-10到+10分，要求直接输出分数而不输出多余的解释等内容。
以下将无锡吉冈精密科技股份有限公司简称为吉冈精密，请对其进行打分。近日，吉冈精密连续第二个交易日上演“地天板”，近7个交易日收获4涨停3跌停。"
839719.BJ,宁新新材,NXXC,"93,093,400.00",江西宁新新材料股份有限公司,"Jiangxi Ningxin New Material Co., Ltd.",民营企业,中型,宁新新材材料、宁新新材等静压特种石墨、宁新新材冷模压特种细结构石墨、宁新新材石墨产品升级、宁新新材委托加工,矿物类非金属矿产,公司成立于2007年，是一家专业从事特种石墨材料研发、生产与销售的企业。宁新新材作为一家特种石墨材料生产企业，已成功完成高密度、高强度石墨的制备，提高焙烧炉烟气净化率和稳定性技术及应用的研究与开发，锅炉燃烧系统改造优化的应用研究，一种石墨抗氧化处理工艺的研发，石墨坩埚生产工艺的研发等多项科技攻关项目，并拥有多项专利技术。公司产品获得江西省重点新产品称号，产品畅销国内十几个省市。,高纯石墨、石墨制品、电极、炭化硅、增炭剂、金刚石材料、炉料(不含危险品)生产及销售；自营和代理各类商品和技术的进出口，但国家限定公司经营或禁止进出口的商品和技术除外。(依法须经批准的项目，经相关部门批准后方可开展经营活动)。,材料,制造业,基础化工,基础化工,"93,093,400.00","1,038,922,344.00","请忘记之前的指令。假装自己是一位金融专家，将要对以下新闻进行打分，利好为正分，利空为负分，分数区间为-10到+10分，要求直接输出分数而不输出多余的解释等内容。
以下将江西宁新新材料股份有限公司简称为宁新新材，请对其进行打分。近日，宁新新材连续第二个交易日上演“地天板”，近7个交易日收获4涨停3跌停。"
837006.BJ,晟楠科技,SHENGNAN TECHNOLOGY,"90,287,200.00",江苏晟楠电子科技股份有限公司,"Jiangsu Shengnan Electronic Technology Co.,Ltd.",民营企业,小型,晟楠科技变压整流器、晟楠科技供电单元、晟楠科技供电柜、晟楠科技管路连接器、晟楠科技航空减速控制器、晟楠科技航空阻尼器、晟楠科技毁钥控制盒、晟楠科技继电器盒、晟楠科技减震器、晟楠科技静止变流器、晟楠科技灭火器控制盒、晟楠科技天馈伺服系统、晟楠科技通信车电源、晟楠科技综合电源方舱,电子元器件,公司主要从事航空装备制造、军用电源领域相关产品的研发、生产和销售。主要产品包括：一次电源及系统、二次电源及软件管理、航空控制器及检测设备、减速机产品、传动机械产品、开关磁阻电机、无人机发电机系统及无人机维修检测设备等。公司产品主要应用于航空等国防军工领域。经过多年的发展，公司与多家军工企业建立了长期的合作关系，已在军工配套产品领域占有一定的市场份额。由于公司军工产品的特殊性，需要具备相应资质，公司已具备生产军品所需的全部资质，产品符合军工产品质量技术要求。经过多年的发展，公司已成为泰州市知名商标、泰兴市重合同守信用企业、江苏省民营科技型企业，拥有多个高新技术产品，并获得专利多项。,电子产品研究、开发与制造；二次电源、混合集成电路、电子对抗设备、发电机、仪器仪表、传动机械设备、机械减振设备、节能电器、机械配件、电气仿真设备研究、开发、制造、销售；专用机电产品销售；车辆装备生产、销售；航空电源系统总体、微波功率模块的研究、开发与制造。(依法须经批准的项目，经相关部门批准后方可开展经营活动)(依法须经批准的项目，经相关部门批准后方可开展经营活动)一般项目：智能车载设备制造；智能车载设备销售；伺服控制机构制造；伺服控制机构销售；光学仪器制造；仪器仪表修理(除依法须经批准的项目外，凭营业执照依法自主开展经营活动)；输配电及控制设备制造；电机制造、电机及其控制系统研发、微特电机及组件制造、微特电机及组件销售；汽车零部件及配件制造。,工业,制造业,国防军工,国防军工,"90,287,200.00","1,021,148,232.00","请忘记之前的指令。假装自己是一位金融专家，将要对以下新闻进行打分，利好为正分，利空为负分，分数区间为-10到+10分，要求直接输出分数而不输出多余的解释等内容。
以下将江苏晟楠电子科技股份有限公司简称为晟楠科技，请对其进行打分。近日，晟楠科技连续第二个交易日上演“地天板”，近7个交易日收获4涨停3跌停。"
430510.BJ,丰光精密,FENGGUANG PRECISION MACHINERY,"131,581,378.00",青岛丰光精密机械股份有限公司,"Qingdao Fengguang Precision Machinery Co.,Ltd.",民营企业,中型,丰光精密金属零部件加工、丰光精密压铸件、精密机械加工件,专用设备与零部件,公司成立于2001年7月，公司主营业务是研发、生产和销售精密机械加工件和压铸件，主要客户为高端装备制造、高速列车/轨道交通、汽车等行业的国内外知名品牌制造商。是一家以高端装备制造、高速列车/轨道交通、汽车零部件等行业的知名品牌制造商提供核心零部件的精密机械加工和压铸制造为核心技术和核心产品的中外合资企业。公司制造、加工的产品种类众多，其中最具代表性和竞争力的产品包括精密直线导轨滑块、高速列车减震器主件、伺服电机主轴、汽车安全带装置转轴、汽车发动机涨紧支臂。,精密轴承及各种电机轴的制造，各种精密机械零部件的加工、组装；铝合金部件及锌合金部件压铸成型及加工，金属制品模具设计、制造。,工业,制造业,机械设备,机械,"131,581,378.00","1,021,071,493.28","请忘记之前的指令。假装自己是一位金融专家，将要对以下新闻进行打分，利好为正分，利空为负分，分数区间为-10到+10分，要求直接输出分数而不输出多余的解释等内容。
以下将青岛丰光精密机械股份有限公司简称为丰光精密，请对其进行打分。近日，丰光精密连续第二个交易日上演“地天板”，近7个交易日收获4涨停3跌停。"
873001.BJ,纬达光电,WINDA,"153,656,204.00",佛山纬达光电材料股份有限公司,"Winda Opto-Electronics Co.,Ltd",地方国有企业,小型,纬达光电偏光片,电子元器件,公司主要从事偏光片和光学薄膜材料的研发、生产与销售。偏光片指将高分子膜材料通过特殊加工制成具有偏振作用的光学材料，主要由PVA膜、TAC膜、保护膜、离型膜和压敏胶等复合制成，是显示面板的核心材料之一。公司主要产品为偏光片，目前按照应用领域分为LCD偏光片及眼镜类偏光片，主要应用在工控仪表、汽车仪表盘液晶显示屏、消费类电子产品、3D眼镜、太阳镜等。,生产经营偏光膜、光电材料、光学薄膜及光电胶粘制品，产品研发、技术服务及委托加工、销售偏光眼镜。,信息技术,制造业,电子,电子,"153,656,204.00","1,018,740,632.52","请忘记之前的指令。假装自己是一位金融专家，将要对以下新闻进行打分，利好为正分，利空为负分，分数区间为-10到+10分，要求直接输出分数而不输出多余的解释等内容。
以下将佛山纬达光电材料股份有限公司简称为纬达光电，请对其进行打分。近日，纬达光电连续第二个交易日上演“地天板”，近7个交易日收获4涨停3跌停。"
872190.BJ,雷神科技,THUNDEROBOT,"100,000,001.00",青岛雷神科技股份有限公司,"Qingdao Thunderobot Technology Co.,Ltd.",集体企业,中型,雷神科技笔记本电脑、雷神科技台式机、雷神科技外设及周边,电脑配件、电脑整机,公司专注于“粉丝交互”模式下游戏笔记本、游戏台式机和游戏外部设备等产品的设计、研发和销售。公司通过与品牌粉丝强黏度交互，贴近游戏玩家内心，为玩家提供性能强悍、品质一流的产品和服务，致力于让每一位玩家都能拥有极致的游戏体验。公司以优质的产品性能和独特的服务理念受到了众多游戏玩家的青睐，在市场上积累了广泛的企业知名度和品牌影响力。公司主营业务为游戏笔记本、游戏台式机和游戏外部设备等产品的设计、研发和销售。公司产品推广成本低、产品针对性强、客户忠诚度高，现有商业模式能够保障企业各项业务的运行，具有可持续性，未来公司将不断优化商业模式，提升企业的运营能力，保障公司长远稳定发展。,研发、生产、销售、网上销售：电脑及电脑配件、电子元器件、家用电器、机电设备(生产不含特种设备)、通讯器材(不含无线电发射及卫星地面接收设施)、办公用品及耗材、办公设备、计算机软件，维修：电脑及配件、办公设备、通讯器材(不含无线电发射及卫星地面接收设施)，软件开发，网络工程(不得从事互联网信息服务及增值电信业务)；网络游戏服务(依据文化部门核发的《网络文化许可证》开展经营活动)；日用百货、服装服饰、皮革制品、鞋帽、洗涤用品、化妆品、摄影器材、玩具、音频设备、电子元器件、五金交电、电器机械及材料、装饰材料、塑料制品、汽车零配件的研发、生产和销售；货物及技术的进出口。(依法须经批准的项目，经相关部门批准后方可开展经营活动),信息技术,制造业,计算机,计算机,"100,000,001.00","1,017,000,010.17","请忘记之前的指令。假装自己是一位金融专家，将要对以下新闻进行打分，利好为正分，利空为负分，分数区间为-10到+10分，要求直接输出分数而不输出多余的解释等内容。
以下将青岛雷神科技股份有限公司简称为雷神科技，请对其进行打分。近日，雷神科技连续第二个交易日上演“地天板”，近7个交易日收获4涨停3跌停。"
832175.BJ,东方碳素,ORIENTAL CARBON,"119,000,000.00",平顶山东方碳素股份有限公司,"Pingdingshan Oriental Carbon Co.,Ltd",民营企业,中型,东方碳素等静压特种石墨材料、东方碳素模压细结构特种石墨材料、东方碳素中粗结构石墨材料,超硬材料,公司是一家专业从事石墨材料研发、生产与销售的企业。公司已成功完成新型敞开式焙烧炉的开发与应用、中粗结构新型石墨材料的研制与开发、新型高炉及铝用预焙微孔炭块的研制与开发、中粗高纯石墨棒的研究与开发、中粗石墨块的研究与开发、一种石墨制品抗氧化涂料及制备方法、焙烧系统中煤气发生炉的技术改造和研究等多项科技攻关项目。,特种石墨制品、锂电池正、负极材料的生产销售；石墨烯的研发；出口贸易。,材料,制造业,基础化工,基础化工,"119,000,000.00","1,012,690,000.00","请忘记之前的指令。假装自己是一位金融专家，将要对以下新闻进行打分，利好为正分，利空为负分，分数区间为-10到+10分，要求直接输出分数而不输出多余的解释等内容。
以下将平顶山东方碳素股份有限公司简称为东方碳素，请对其进行打分。近日，东方碳素连续第二个交易日上演“地天板”，近7个交易日收获4涨停3跌停。"
833429.BJ,康比特,CPT,"124,500,000.00",北京康比特体育科技股份有限公司,"Beijing Competitor Sports Science Technology Joint Stock Co., Ltd",民营企业,中型,康比特健康营养食品、康比特受托加工业务、康比特数字化体育科技服务、康比特运动营养食品,保健食品、蔬菜加工制品、休闲食品、专业咨询服务,公司是中国第一家集研发、生产、销售运动营养食品于一体，并提供运动营养技术服务的高新技术企业，长期以来一直为国家级专业运动员和大众健身人群提供安全有效的系列化运动营养食品和专业化技术咨询服务，经过近十年的飞速发展，康比特的市场份额稳居国内同行业榜首。2006年7月，康比特公司投资建设的“运动营养产业基地”将落成投产，产业基地将成为整合运动营养行业上下游企业的“产业孵化器”，产业基地的投入使用是我国运动营养行业向产业化方向迈进的重要标志。,技术开发、技术咨询、技术转让、技术推广、技术服务；软件开发；货物进出口、代理进出口(涉及配额许可证管理、专项规定管理的商品按照国家有关规定办理)；建设工程项目管理；城市园林绿化；体育场馆经营；健身服务；企业管理；投资咨询(不含中介服务)；销售电子产品、厨房用具、体育器材、计算机软件、手机软件、化妆品、科研设备、健身器材、文化体育品及配套产品、医疗器械一、二类、食品添加剂；组织体育文化交流活动(不含演出)；经营篮球、羽毛球、网球、足球、排球、乒乓球、手球、跑步、自行车、射箭、轮滑、跆拳道、舞蹈体育项目；出租商业用房、办公用房；施工总承包、专业承包；物业管理；委托加工；生产食品；受委托生产食品；销售食品，以商业特许经营方式开展经营活动；销售第三类医疗器械；食品添加剂生产。(市场主体依法自主选择经营项目，开展经营活动；生产食品、受委托生产食品、销售食品、销售第三类医疗器械、食品添加剂生产以及依法须经批准的项目，经相关部门批准后依批准的内容开展经营活动；不得从事国家和本市产业政策禁止和限制类项目的经营活动。),日常消费,制造业,食品饮料,食品饮料,"124,500,000.00","1,009,695,000.00","请忘记之前的指令。假装自己是一位金融专家，将要对以下新闻进行打分，利好为正分，利空为负分，分数区间为-10到+10分，要求直接输出分数而不输出多余的解释等内容。
以下将北京康比特体育科技股份有限公司简称为康比特，请对其进行打分。近日，康比特连续第二个交易日上演“地天板”，近7个交易日收获4涨停3跌停。"
870866.BJ,绿亨科技,LUHENG GROUP,"180,205,900.00",绿亨科技集团股份有限公司,"Luheng Technology Group Co.,Ltd.",民营企业,中型,绿亨科技10%灭蝇胺、绿亨科技40%双草醚、绿亨科技40%硝·烟·莠去津、绿亨科技5%高效氯氰菊酯、绿亨科技5%甲维·高氯氟、绿亨科技不结球白菜种子、绿亨科技噁霉灵系列、绿亨科技番茄种子、绿亨科技辣椒种子、绿亨科技氯溴异氰尿酸、绿亨科技四季豆种子、绿亨科技甜玉米种子、绿亨科技铜制剂系列、绿亨科技西瓜种子,化学试剂、有机化学农药、种子,公司是一家集研发、生产、加工、销售于一体的现代股份制农药、种子企业，集团总部在北京市中关村翠湖科技园。公司在天津滨海新区和沧州渤海新区临港经济技术开发区占地百余亩建有农药生产基地。公司拥有农药相关发明专利2项，农药相关实用新型专利近30项，公司有4个农药原药登记证，99个农药制剂登记证，1个水溶性肥料登记证。公司在北京海淀、山东寿光、甘肃酒泉、广州南沙建有育种研发及品种测试鉴定基地，并与中国农业大学园艺学院联合建立了绿亨蔬菜育种工作站，寿光绿亨还建有8000平方米的高标准现代化的蔬菜种子研发及加工中心。目前公司种子相关发明专利3项，有19个品种获得植物新品种权，另有十余个品种正在申报植物新品种权，并且进入临时保护期；多个玉米品种获得品种审定证书。,一般经营项目：农业科学研究和试验发展；蔬菜种植；水果种植；肥料销售；初级农产品收购；化工产品销售(不含许可类化工产品)；企业总部管理；财务咨询；以自有资金从事投资活动；企业管理咨询；法律咨询(不包括律师事务所业务)；信息咨询服务(不含许可类信息咨询服务)；非居住房地产租赁；技术服务、技术开发、技术咨询、技术交流、技术转让、技术推广。许可经营项目：农药批发；农作物种子经营；货物进出口；技术进出口；农药零售。,材料,制造业,基础化工,基础化工,"180,205,900.00","994,736,568.00","请忘记之前的指令。假装自己是一位金融专家，将要对以下新闻进行打分，利好为正分，利空为负分，分数区间为-10到+10分，要求直接输出分数而不输出多余的解释等内容。
以下将绿亨科技集团股份有限公司简称为绿亨科技，请对其进行打分。近日，绿亨科技连续第二个交易日上演“地天板”，近7个交易日收获4涨停3跌停。"
839680.BJ,广道数字,SUNTANG,"66,999,900.00",深圳市广道数字技术股份有限公司,"Shenzhen Suntang Digital Technology Co., Ltd.",民营企业,中型,广道大数据运营系统、广道高新容灾备份系统、广道高新图灵舆情智能分析系统、广道高新网络安全审计系统、广道高新无线接入管控系统,行业专用软件,公司是拥有完全自主知识产权的高科技企业，是网络安全产品、智能网络应用管理平台，专业安全服务与解决方案的综合提供商。专业从事信息安全、情报分析领域及信息化平台建设的相关技术和产品的研发、生产，销售和服务。同时，广道也是提供国家信息安全等级保护相关服务的授权厂商。公司主营业务为数据采集及分析类软件产品的研究、开发和销售，为城市公共安全相应领域提供数据感知及分析的嵌入式软硬件设备提供商。综合运用信息安全、物联网、人工智能、云计算与大数据分析等数字技术，进行产品核心软件的研发，为客户提供相关数据嵌入式软硬设备产品，助力新型智慧城市建设。公司自主研发的系列产品应用领域主要涉及治安维稳、案件侦破、市政执法、生态环境等城市公共安全方面。,计算机软、硬件及系统集成的技术开发与销售；电子产品及元器件、通讯产品的技术开发与销售；(以上不含专营、专控、专卖商品)。经营进出口业务(法律、行政法规、国务院决定禁止的项目除外，限制的项目须取得许可后方可经营)。,信息技术,信息传输、软件和信息技术服务业,计算机,计算机,"66,999,900.00","993,608,517.00","请忘记之前的指令。假装自己是一位金融专家，将要对以下新闻进行打分，利好为正分，利空为负分，分数区间为-10到+10分，要求直接输出分数而不输出多余的解释等内容。
以下将深圳市广道数字技术股份有限公司简称为广道数字，请对其进行打分。近日，广道数字连续第二个交易日上演“地天板”，近7个交易日收获4涨停3跌停。"
