603416.SH,信捷电气,XINJE,"140,560,000.00",无锡信捷电气股份有限公司,"Wuxi Xinje Electric Co.,Ltd.",民营企业,大型,步进驱动、低压变频器、工业触摸屏、机器视觉、可编程控制器、伺服系统、通讯模块、文本显示器、一体机,专用设备与零部件,公司作为中国工控市场最早的参与者之一，长期专注于机械设备制造行业自动化水平的提高。主要产品有可编程控制器(PLC)、人机界面(HMI)、伺服控制系统、变频驱动、智能机器视觉系统、工业机器人等产品系列及整套自动化装备。产品广泛应用于各种自动化领域，包括航空航天、太阳能、风电、核电、隧道工程、纺织机械、数控机床、动力设备、煤矿设备、中央空调、环保工程等控制相关的行业和领域。公司致力于工控产品的研发、生产和销售，为工控领域和自动化行业的高新技术企业。公司是江苏省高新技术企业，先后被评为江苏省民营科技企业、无锡市领军型创新企业、“2012年度无锡市十佳物联网企业”。公司“无锡信捷电气股份有限公司工业自动化智能控制技术研究院”，获得了“江苏省工程技术研究中心”、“江苏省企业技术中心”的资质认定。,电气机械及器材、工业自动控制系统装置的开发、制造、销售；工业自动化控制软件的技术开发、技术转让、技术咨询和技术服务；电子产品的生产销售；计算机产品的生产销售；自营和代理各类商品及技术的进出口业务(国家限定企业经营或禁止进出口的商品和技术除外)。,工业,制造业,机械设备,机械,"140,560,000.00","5,755,932,000.00","请忘记之前的指令。假装自己是一位金融专家，将要对以下新闻进行打分，利好为正分，利空为负分，分数区间为-10到+10分，要求直接输出分数而不输出多余的解释等内容。
以下将无锡信捷电气股份有限公司简称为信捷电气，请对其进行打分。近日，信捷电气连续第二个交易日上演“地天板”，近7个交易日收获4涨停3跌停。"
300063.SZ,天龙集团,TLJT,"753,931,950.00",广东天龙科技集团股份有限公司,"Guangdong Tloong Technology Group Co.,Ltd",民营企业,大型,天龙TLA型水性油墨、天龙TLB型水性油墨、天龙TLCC纯彩系列快固亮光胶印油墨、天龙TLDC多彩系列快固树脂胶印油墨、天龙TLF型凹版塑料(里印)油墨、天龙TLGA型铝箔凹版油墨、天龙TLGM型凹版塑料(表印)油墨、天龙TLG型凹版塑料(表印)油墨、天龙TLJC精彩系列高级四色胶印油墨、天龙TLT系列PET、NY复合油墨、天龙TLV型水性上光油墨、天龙TL-W型水性珠光连结料、天龙TLY型纸张凹版油墨、天龙TL型水性油墨、天龙ZS系列水性油墨,染料及颜料,公司是全国大型的水性、溶剂及胶版油墨专业生产商，一直专注于水性油墨的研发、生产和销售。公司产品广泛应用于各类包装印刷。依托公司在国内领先的水性油墨研究技术和自主研发的合成树脂技术，形成了集水性油墨研发、生产、销售及售后服务于一体的完整产业链。2015年公司经过重大资产重组，实现公司战略转型升级，转型至传统化工行业与新型互联网营销行业并驾齐驱的立体式布局。公司倡导诚信、务实、创新、成就的企业精神，拥有一批优秀的专业技术人才和管理人才，已形成了完善的组织架构和科学的管理模式。天龙集团致力于建立绿色环保企业，严格执行ISO9001:2015质量管理体系、ISO14001:2015环境管理体系、RoHS绿色产品管理体系、环境标志产品保障措施体系。,一般项目：油墨制造（不含危险化学品）；油墨销售（不含危险化学品）；化工产品生产（不含许可类化工产品）；化工产品销售（不含许可类化工产品）；技术服务、技术开发、技术咨询、技术交流、技术转让、技术推广；数据处理和存储支持服务；以自有资金从事投资活动；企业总部管理；广告设计、代理；广告制作；广告发布；信息咨询服务（不含许可类信息咨询服务）；非居住房地产租赁（除依法须经批准的项目外，凭营业执照依法自主开展经营活动）,可选消费,租赁和商务服务业,传媒,传媒,"753,931,950.00","5,752,500,778.50","请忘记之前的指令。假装自己是一位金融专家，将要对以下新闻进行打分，利好为正分，利空为负分，分数区间为-10到+10分，要求直接输出分数而不输出多余的解释等内容。
以下将广东天龙科技集团股份有限公司简称为天龙集团，请对其进行打分。近日，天龙集团连续第二个交易日上演“地天板”，近7个交易日收获4涨停3跌停。"
301251.SZ,威尔高,WELGAO,"134,621,760.00",江西威尔高电子股份有限公司,"Jiangxi Welgao Electronics Co., Ltd.",民营企业,大型,多层印制电路板、双面印制电路板,电子元器件,公司主营业务是印制电路板的研发、生产和销售，产品包括双面板、多层板，产品类型覆盖厚铜板、Mini LED光电板、平面变压器板等，产品应用于工业控制、显示、消费电子、通讯设备等领域，报告期工业控制和显示领域的PCB产品收入占比合计约为69%。公司是国家高新技术企业、江西省两化深度融合示范企业、江西省专精特新中小企业，拥有江西省省级企业技术中心、江西省“5G+工业互联网”应用示范工厂，在高精度、高密度和高可靠性印制电路板研发与生产领域积累了丰富经验。公司高管和核心技术人员具备多年PCB行业工作经验，拥有PCB制造企业的现代化管理经验。公司通过“质量先行”的理念与行动结合，技术人员聚焦生产现场，严格推行“品质追溯到人、问题追溯到点、品质问题闭环管理”，配置智能生产系统与检测设备，保证产品品质。公司推行“阿米巴”经营管理模式，通过信息化管理方式，对生产数据实时跟踪，持续推行每工序每月降本增效。公司持续致力于新产品的研发和生产工艺的改善，重视自动化与智能化，实现了生产线上物料的自动传递、数据的实时监控，生产效率得到大幅提升。,电子产品生产、销售；双面及多层印刷线路板、LED节能灯；线路板、机器设备、原材料进出口(法律、行政法规禁止的项目除外，限制的项目取得许可后方可经营。***依法须经批准的项目，经相关部门批准后方可经营),信息技术,制造业,电子,电子,"134,621,760.00","5,752,387,804.80","请忘记之前的指令。假装自己是一位金融专家，将要对以下新闻进行打分，利好为正分，利空为负分，分数区间为-10到+10分，要求直接输出分数而不输出多余的解释等内容。
以下将江西威尔高电子股份有限公司简称为威尔高，请对其进行打分。近日，威尔高连续第二个交易日上演“地天板”，近7个交易日收获4涨停3跌停。"
002169.SZ,智光电气,ZHIGUANG ELECTRIC,"787,791,994.00",广州智光电气股份有限公司,"Guangzhou Zhiguang Electric Co.,Ltd.",民营企业,大型,智光电气电机控制与节能、智光电气电气监控与能量管理系统、智光电气高压变频调速系统、智光电气供用电控制与自动化、智光电气消弧选线成套装置,变电设备、继电保护及调度自动化,"公司是一家在电气控制与自动化领域里具有自主创新能力和高成长性的高新技术企业,主要从事电网安全与控制设备、电机控制与节能设备、供用电控制与自动化设备及电力信息化系统研发、设计、生产和销售。一直专注于电气智能化控制技术的研究以及产品开发、产业化和应用；致力于能源动力领域节能增效技术研究以及解决方案设计、工程应用和服务提供。同时公司全方位开展清洁能源、可再生能源等新能源、分布式能源与传统能源相结合的技术研究和综合利用。帮助客户安全、节约、舒适地使用能源，成为智慧能源的追求者和倡导者。",电气、电子、计算机及自动化产品的开发、加工、安装、设计、技术服务。销售：电气设备、电子产品、电子计算机。货物进出口、技术进出口(法律、行政法规禁止的项目除外；法律、行政法规限制的项目须取得许可后方可经营)。,工业,制造业,电力设备,电力设备及新能源,"787,791,994.00","5,750,881,556.20","请忘记之前的指令。假装自己是一位金融专家，将要对以下新闻进行打分，利好为正分，利空为负分，分数区间为-10到+10分，要求直接输出分数而不输出多余的解释等内容。
以下将广州智光电气股份有限公司简称为智光电气，请对其进行打分。近日，智光电气连续第二个交易日上演“地天板”，近7个交易日收获4涨停3跌停。"
002059.SZ,云南旅游,YUNNAN TOURISM,"1,012,434,813.00",云南旅游股份有限公司,"Yunnan Tourism Co., Ltd.",中央国有企业,大型,昆明世博园、世博清洁和花卉等、云南世博兴云房地产,旅游景点、植物及花卉、住宅楼盘,公司是昆明世博会的产物，目前主要经营管理世博园。公司已升级为旅游社区开发营运商，主营将包括世博园景点景区的投资、经营管理、园林园艺产品的展示、旅游房地产投资、生物产品的开发利用等。作为世界上唯一完整保留的世博会会址，世博园凭借全世界规模最大、最具原创性的园林园艺大观园独有的历史文化和景观价值，已经成为具有世界性、民族性、园艺性、高品位性、唯一性、不可模仿性、价值可持续性的会址文化遗产，其所处的昆明市是全国十大热点旅游城市之一，并首批进入“中国优秀旅游城市”行列。,景区景点的投资、经营及管理，物业租赁，园林园艺产品展示，旅游房地产投资，生物产品开发及利用，旅游商贸，旅游商品设计、开发、销售，旅游服务(景区导游礼仪服务、园区旅游交通服务、摄影摄像服务和照相业务)，餐饮经营服务，婚庆服务，会议及会务接待，度假村开发经营，广告经营、会展、旅游咨询，文化产品开发，旅游商品开发，进出口业务。,可选消费,水利、环境和公共设施管理业,社会服务,消费者服务,"1,012,434,813.00","5,750,629,737.84","请忘记之前的指令。假装自己是一位金融专家，将要对以下新闻进行打分，利好为正分，利空为负分，分数区间为-10到+10分，要求直接输出分数而不输出多余的解释等内容。
以下将云南旅游股份有限公司简称为云南旅游，请对其进行打分。近日，云南旅游连续第二个交易日上演“地天板”，近7个交易日收获4涨停3跌停。"
603639.SH,海利尔,HAILIR,"340,230,446.00",海利尔药业集团股份有限公司,"Hailir Pesticides and Chemicals Group Co.,Ltd.",民营企业,大型,2-氯-5氯甲基吡啶中间体、吡虫啉、除草剂、啶虫脒、嘧菌酯、噻虫嗪、杀虫剂、杀菌剂、茚虫威,农药中间体、有机化学农药,公司是集农药和功能性肥料研发、生产、销售为一体的大型农化集团，属国家定点农药生产企业。公司坚持走科技兴企之路，集团研发中心被认定为国家级企业技术中心，承担国家863计划、国家十二五科技支撑计划、国家星火计划和国家火炬计划，拥有发明专利多项，参与制定国家标准多项，多次荣获国家、省、市科技进步奖。集团先后被认定为国家级高新技术企业、国家火炬计划重点高新技术企业和国家创新型试点企业。公司的产品先后获得“青岛名牌产品”、“山东名牌产品”、“中国农民最喜爱的农药品牌”、“中国市场公认十佳品牌”称号。集团先后被评为山东省十优农药经营单位、质量信誉双优示范单位等称号。,水溶肥料生产与销售；农药生产与销售(肥料临时登记证，农药生产许可证有效期限以许可证为准)。化工原料(不含危险品)生产；货物和技术的进出口；农业、林业有害生物防治与技术咨询服务；园林绿化养护；遥感测绘服务、摄影服务；电子商务、软件开发、软件业和信息技术服务。(依法须经批准的项目，经相关部门批准后方可开展经营活动)。,材料,制造业,基础化工,基础化工,"340,230,446.00","5,749,894,537.40","请忘记之前的指令。假装自己是一位金融专家，将要对以下新闻进行打分，利好为正分，利空为负分，分数区间为-10到+10分，要求直接输出分数而不输出多余的解释等内容。
以下将海利尔药业集团股份有限公司简称为海利尔，请对其进行打分。近日，海利尔连续第二个交易日上演“地天板”，近7个交易日收获4涨停3跌停。"
603912.SH,佳力图,CANATAL,"541,772,824.00",南京佳力图机房环境技术股份有限公司,"Nanjing Canatal Data-Centre Environmental Tech Co.,Ltd",民营企业,中型,精密空调FJ 氟泵系列、精密空调Guardian 系列、精密空调ME 系列、精密空调ME 直流变频系列、精密空调rCooling 系列、精密空调ZW 中温系列、冷水机组iChiller 系列,空调器具、专用设备与零部件,公司是一家为数据机房等精密环境控制领域提供节能、控温设备、一体化解决方案以及相关节能技术服务的高新技术企业，一直专注于数据机房等精密环境控制技术的研发。公司主要产品为精密空调设备及冷水机组产品，同时公司凭借多年的技术积累和在节能控制方面的领先技术，为客户提供技术服务业务，包括旨在解决老旧数据中心高能耗问题的节能改造服务以及数据中心的运行维护服务等。公司产品应用于数据中心机房、通信基站以及其他恒温恒湿等精密环境，客户涵盖政府部门以及通信、金融、互联网、医疗、轨道交通、航空、能源等众多行业。经过十多年的积累和沉淀，形成了一个稳定、高素质的研发团队，能够高效完成研发任务，先后荣获中国工程建设标准化协会颁发的“绿色建筑节能产品证书”，中国数据中心节能技术委员会颁发的“中国高效数据中心优秀产品奖”，及“中国高效数据中心优秀解决方案奖”。,开发、生产各种空调、制冷设备及机房环境一体化工程设备等、数据中心微模块系统、机柜、通道封闭、智能管理监控系统、供配电系统、不间断电源及电池系统、机房系统等，并对以上产品进行安装、维修、备件供应及技术服务；销售自产产品；上述领域软、硬件系统的设计开发、技术咨询；建筑智能化工程的设计与施工、机电设备安装工程的设计与施工、装饰装修工程的设计与施工、机房电子工程的设计与施工、节能工程的设计与施工、计算机系统集成的设计与施工。（工程类凭相关资质证书从事经营）。（依法须经批准的项目，经相关部门批准后方可开展经营活动）,工业,制造业,机械设备,机械,"541,772,824.00","5,748,209,662.64","请忘记之前的指令。假装自己是一位金融专家，将要对以下新闻进行打分，利好为正分，利空为负分，分数区间为-10到+10分，要求直接输出分数而不输出多余的解释等内容。
以下将南京佳力图机房环境技术股份有限公司简称为佳力图，请对其进行打分。近日，佳力图连续第二个交易日上演“地天板”，近7个交易日收获4涨停3跌停。"
300304.SZ,云意电气,YYDQ,"874,640,918.00",江苏云意电气股份有限公司,"Jiangsu Yunyi Electric Co., Ltd",民营企业,大型,车用调节器、车用整流器、雨刷系统、智能电源控制器,专用设备与零部件,公司自成立以来一直致力于汽车智能核心电子产品的研发和生产，是国家级高新技术企业、江苏省技术改造先进企业、建有江苏省汽车智能电压调节器工程技术研究中心、江苏省认定企业技术中心等一系列高规格、高水平的研发平台。凭借突出的研发实力，公司参与起草中国内燃机和机动车用整流器行业标准和大功率车用二极管行业标准。公司凭借较强的研发创新能力和技术实力，产品质量和性能处于行业领先地位，持续通过国内外客户的产品认证程序，并与整车厂商建立了长期稳定的战略合作配套关系，积累了大量优质的客户资源，为众多汽车品牌进行配套。公司已在大功率车用二极管、高度集成的模块化芯片和精密嵌件注塑件等关键零部件上掌握了核心技术，具备集智能电源控制器深度结构设计、精密嵌件模具设计、制造及注塑于一体的垂直整合能力。公司是国内规模领先的行业龙头企业，规模化生产使公司具备较强的规模优势。,生产汽车零部件、电力电子元件、汽车电子装置、汽车仪器仪表、集成电路；销售自产产品；软件开发、销售；模具研发、制造、销售、技术咨询服务；自有房屋出租；自营和代理各类商品及技术的进出口业务（国家限定经营或禁止进出口的商品及技术除外）。（依法须经批准的项目，经相关部门批准后方可开展经营活动）一般项目：计算机及通讯设备租赁；办公设备租赁服务；仓储设备租赁服务；租赁服务（不含许可类租赁服务）（除依法须经批准的项目外，凭营业执照依法自主开展经营活动）,可选消费,制造业,汽车,汽车,"874,640,918.00","5,746,390,831.26","请忘记之前的指令。假装自己是一位金融专家，将要对以下新闻进行打分，利好为正分，利空为负分，分数区间为-10到+10分，要求直接输出分数而不输出多余的解释等内容。
以下将江苏云意电气股份有限公司简称为云意电气，请对其进行打分。近日，云意电气连续第二个交易日上演“地天板”，近7个交易日收获4涨停3跌停。"
300552.SZ,万集科技,WANJI TECH,"213,133,112.00",北京万集科技股份有限公司,"Vanjee Technology Co., Ltd.",民营企业,大型,动态称重、激光检测、专用短程通信技术,行业专用软件,公司是专业从事智能交通系统(ITS)技术研发、产品制造、技术服务的国家高新技术企业。公司研发出以动态称重、专用短程通信、激光检测、汽车电子标识、智能网联汽车为核心技术的全系列多种产品，在智能交通信息采集与处理行业取得了领先的市场地位。基于对动态称重技术的成熟应用，公司推出了秤台式、弯板式、联体秤、轴组秤、整车式、便携式等系列产品，覆盖高速公路计重收费、公路超限超载治理、道路桥梁保护、道路安全执法等应用领域，并为用户提供多样化的系统解决方案。凭借雄厚的研发实力、多年的技术积淀和大量的研发投入，万集科技在传感器设计、数据采集、核心算法及系统控制等技术方面取得创造性突破，已成为国内市场最大的动态称重设备供应商之一。公司是国家火炬计划重点高新技术企业、北京科技研究开发机构和北京市企业技术中心，拥有建筑企业资质和计算机系统集成资质，并通过了ISO9001质量管理认证。公司获得了中关村“十百千工程企业”、“北京市软件和信息服务业四个一批工程企业”、“中关村高成长企业TOP100”、“中关村瞪羚计划重点培育企业”等多项荣誉，及中国智能交通协会科学技术奖、北京公路学会科学技术奖等多个奖励。,计算机与电子信息、无线数据终端、车联网终端产品、车载无线终端产品、机动车检测、光电子产品及雷达、车用电子产品、集成电路产品、微电子产品、半导体材料及器件的技术开发、技术服务、技术咨询；系统集成；产品设计；集成电路设计；集成电路芯片设计；产品安装；专业承包；销售自产产品；技术进出口；以下项目限分支机构经营：生产加工（装配）智能控制系统、控制仪表系统、载波通信传输设备、通信发射机、接收机、公路交通数据采集器、车载电子标签（OBU）、路侧读写单元（RSU）、自动化计量设备。（市场主体依法自主选择经营项目，开展经营活动；依法须经批准的项目，经相关部门批准后依批准的内容开展经营活动；不得从事国家和本市产业政策禁止和限制类项目的经营活动。）,信息技术,信息传输、软件和信息技术服务业,计算机,计算机,"213,133,112.00","5,746,068,699.52","请忘记之前的指令。假装自己是一位金融专家，将要对以下新闻进行打分，利好为正分，利空为负分，分数区间为-10到+10分，要求直接输出分数而不输出多余的解释等内容。
以下将北京万集科技股份有限公司简称为万集科技，请对其进行打分。近日，万集科技连续第二个交易日上演“地天板”，近7个交易日收获4涨停3跌停。"
688205.SH,德科立,TACLINK,"100,744,021.00",无锡市德科立光电子技术股份有限公司,"Wuxi Taclink Optoelectronics Technology Co., Ltd.",民营企业,中型,光传输子系统、光放大器、光收发模块,专用设备与零部件,发行人深耕光电子器件行业二十余年，主营业务涵盖光收发模块、光放大器、光传输子系统的研发、生产和销售，产品主要应用于通信干线传输、5G前传、5G中回传、数据链路采集、数据中心互联、特高压通信保护等国家重点支持发展领域。公司以原创技术为核心，以先进封装技术和生产制造工艺为抓手，坚持主营业务不动摇，拥有一整套核心产品和技术，包括“高速光学器件封装技术”、“高速光收发模块长距离传输技术”、“高频仿真技术”、“小型化光放大器技术”、“热插拔光放大器技术”、“光传输子系统超长距传输技术”、“长距离5G前传传输技术”、“数据链路光放大器技术”等，是推动行业技术发展的重要力量。,光电子产品、光纤放大器、光模块、子系统、光器件、高速光电收发芯片的技术开发、技术服务、制造、销售；通讯、数据中心系统集成及工程承包，并提供测试及技术咨询服务；自营和代理各类商品及技术的进出口（国家限定公司经营或禁止进出口的商品和技术除外）；经营进料加工和“三来一补”业务；自有房屋租赁。（依法须经批准的项目，经相关部门批准后方可开展经营活动）一般项目：移动通信设备制造；移动通信设备销售；光通信设备销售；光通信设备制造；卫星移动通信终端制造；卫星移动通信终端销售；5G通信技术服务；电池销售；变压器、整流器和电感器制造；信息系统集成服务（除依法须经批准的项目外，凭营业执照依法自主开展经营活动）,信息技术,制造业,通信,通信,"100,744,021.00","5,739,386,876.37","请忘记之前的指令。假装自己是一位金融专家，将要对以下新闻进行打分，利好为正分，利空为负分，分数区间为-10到+10分，要求直接输出分数而不输出多余的解释等内容。
以下将无锡市德科立光电子技术股份有限公司简称为德科立，请对其进行打分。近日，德科立连续第二个交易日上演“地天板”，近7个交易日收获4涨停3跌停。"
